{
  "schemaVersion": "1.0",
  "date": "2026-05-04",
  "intro": "下周 6 校活动｜墨大夜市 5/7 · UQ 心理健康日 5/5-5/6 · Monash 骄傲之夜泳池派对 5/4",
  "schools": [
    {
      "code": "umelb",
      "events": [
        {
          "title": "Melba Hall 大提琴音乐会",
          "time": "周一 5/4 下午 1:10-2:00",
          "location": "Melba Hall · Parkville 校区",
          "price": "免费",
          "category": "现场演出",
          "url": "https://events.humanitix.com/melba-hall-6-cello-showcase"
        },
        {
          "title": "UMSU 国际美食夜市 2026",
          "time": "周四 5/7 下午 5:00-10:00",
          "location": "大学广场草坪（Concrete Lawn）· Parkville 校区",
          "price": "免费入场",
          "category": "夜市/社交",
          "url": "https://umsu.unimelb.edu.au/ents/event/10430/"
        }
      ],
      "xhsDraft": {
        "title": "墨大下周｜大提琴音乐会+国际夜市",
        "body": "下周墨大有两个不用花钱的活动。\n\n周一下午 1 点 10 分，Melba Hall 有一场大提琴音乐会，是 Conservatorium 午间系列的第 6 场。Melba Hall 空间不大，演奏者离观众很近，听感和大音乐厅完全不一样。票在 Humanitix 上提前领，免费但名额有限，建议这两天就去预约。\n\n周四晚上才是重头戏——UMSU 国际夜市在 Concrete Lawn 开幕，下午 5 点到晚上 10 点。各国文化的食物摊、手工品、现场表演都有，入场不需要买票，带多少钱全看自己吃多少。下午 7 点左右人最密，想抢热门摊位的话早点去。\n\n两个活动都开放给所有人，不限学院也不限 member 身份，带朋友一起去完全没问题。你们周四打算去夜市哪个摊位？评论区聊聊。",
        "tags": ["#墨尔本大学", "#UMelb", "#澳洲留学", "#墨尔本", "#校园活动", "#国际夜市", "#留学日常"]
      }
    },
    {
      "code": "unsw",
      "events": [],
      "xhsDraft": {
        "title": "UNSW 下周｜期中月无大型活动",
        "body": "Roundhouse 的 Bowling For Soup 巡演上周日刚结束，下周 UNSW 官方和 Arc 的公开日程上暂时没有免费开放的大活动。\n\n进入五月，期中周逼近，校园节奏明显安静下来。Main Library Lawn 白天人会多，Lower Campus food court 周三午间反而是一周里人最少的时间段，找位置坐下来专心做题比较合适。\n\nArc 有每周常规的免费早餐——周三早上在 Figure 8 Pond 旁边，不需要预约，直接去拿。不是什么大活动，就是一个低成本让自己出门见人的理由，适合在宿舍坐太久之后出来换换脑子。\n\n五月中旬之后 Arc 通常会有 Mid-Sem 后的 networking 和社团活动，建议关注 @arc.unsw 的 Instagram，活动公告比官网早两三天。UNSW 的同学下周在哪自习？评论区聊聊。",
        "tags": ["#新南威尔士大学", "#UNSW", "#澳洲留学", "#悉尼", "#校园生活", "#留学日常", "#UNSW日常"]
      }
    },
    {
      "code": "uq",
      "events": [
        {
          "title": "大学心理健康日 · Herston 校区",
          "time": "周二 5/5 上午 11:30-下午 1:00",
          "location": "Herston 校区",
          "price": "免费",
          "category": "健康/社交",
          "url": "https://life.uq.edu.au/uni-mental-health-day"
        },
        {
          "title": "UQU 每周三集市",
          "time": "周三 5/6 上午 8:00-下午 3:00",
          "location": "Campbell Place · St Lucia 校区",
          "price": "免费",
          "category": "市集",
          "url": "https://uqu.com.au/food-retail-outlets/wednesday-markets/"
        },
        {
          "title": "UQ Ventures Empower 女性创业路演日",
          "time": "周四 5/7 下午 5:30-8:00",
          "location": "The Precinct · Fortitude Valley",
          "price": "免费（需在 Eventbrite 领票）",
          "category": "创业/交流",
          "url": "https://www.eventbrite.com.au/e/uq-ventures-empower-demo-day-2026-tickets-1987025095550"
        }
      ],
      "xhsDraft": {
        "title": "UQ 下周｜心理健康日+每周三市集",
        "body": "下周 UQ 有三个活动值得标记一下。\n\n周二上午 11 点半，Herston 校区有大学心理健康日活动，内容包括做迷你盆栽、踩 smoothie 自行车、小狗陪伴区，还有免费零食。医学和护理方向的同学对这个校区更熟，其他校区的人坐车过去也不远，专程去一趟很合算。\n\n周三全天，St Lucia 的 Campbell Place 照常开集市，上午 8 点到下午 3 点。鲜花、手工首饰、各类食物摊都有。不一定要买什么，出来逛一圈换换脑子也挺好。\n\n周四傍晚 5 点半，UQ Ventures 在 Fortitude Valley 有一场女性创业者路演——Empower Demo Day，任何人都可以去观看，不需要 UQ 学生身份，去 Eventbrite 上免费领票就行。想接触本地创业圈的同学不要错过。\n\nUQ 的同学下周去集市买什么？评论区聊聊。",
        "tags": ["#昆士兰大学", "#UQ", "#澳洲留学", "#布里斯班", "#校园活动", "#创业", "#留学日常"]
      }
    },
    {
      "code": "usyd",
      "events": [
        {
          "title": "双年展学生导览 · 周周可参加",
          "time": "周一至周日 5/4-5/10 下午 12:30-2:30",
          "location": "Chau Chak Wing Museum · Camperdown 校区",
          "price": "免费（需预约）",
          "category": "展览/导览",
          "url": "https://whatson.cityofsydney.nsw.gov.au/events/biennale-of-sydney-student-led-art-tours"
        },
        {
          "title": "中东考古与殖民史双年展论坛",
          "time": "周四 5/7 下午 6:00-7:00",
          "location": "Chau Chak Wing Museum · Camperdown 校区",
          "price": "学生免费 / 公众 $5",
          "category": "学术论坛",
          "url": "https://neaf.sydney.edu.au/archaeology-art-and-colonialism-in-the-middle-east-a-biennale-panel-discussion/"
        }
      ],
      "xhsDraft": {
        "title": "悉尼大学下周｜双年展免费导览",
        "body": "下周 USYD 校园里的 Chau Chak Wing Museum 有两个场合可以去。\n\n整个下周每天下午 12 点半到 2 点半都有双年展的学生导览，带队的是 USYD 艺术系和艺术史系的学生。每个导览员讲的角度不太一样，不是那种走马观花的录音播报，互动感挺强。去之前在 Eventbrite 上提前领票，免费但需要预约。\n\n周四晚上 6 点，Near Eastern Archaeology Foundation 在同一个博物馆有一场讲中东考古与殖民史的论坛，学生进场免费，公众 5 澳元。主题听起来学术，但这类跨学科对话现场的问答环节往往比讲座本身更有意思。1 小时，不会太久。\n\n两个活动都在 Camperdown 主校区，从 Central 坐车过来很方便。有想一起去的同学评论区扣 1。",
        "tags": ["#悉尼大学", "#USYD", "#澳洲留学", "#悉尼", "#校园活动", "#双年展", "#留学日常"]
      }
    },
    {
      "code": "adelaide",
      "events": [
        {
          "title": "Elder Conservatorium 午间音乐会",
          "time": "周五 5/8 下午 1:10",
          "location": "Elder Hall · North Terrace 校区",
          "price": "学生免费 / 公众 $7",
          "category": "现场演出",
          "url": "https://www.adelaide.edu.au/about/events/2026/elder-conservatoriums-lunchtime-concert-series/"
        }
      ],
      "xhsDraft": {
        "title": "阿德大下周｜Elder Hall 周五音乐会",
        "body": "阿德莱德大学下周公开活动不多，但有一个场合可以参考。\n\n周五下午 1 点 10 分，Elder Hall 有 Elder Conservatorium 的午间音乐会系列。阿大和 UniSA 学生凭学生证免费入场，其他人票价约 7 澳元。这个系列从 3 月跑到 11 月每周五都有，Elder Hall 是 North Terrace 校区里的老建筑，音响条件在南澳的小型演出场地里算比较好的。\n\n阿德莱德城区面积小，North Terrace 这一带可以慢慢逛——州立博物馆、艺术馆、图书馆都在 10 分钟步行范围内。下周学校大型活动少，正好是探索周边的时间。\n\nAUSA（Adelaide University Student Association）今年刚接手 AUU 的工作，五月后半段应该会陆续有活动公告，建议关注他们的页面。有在阿德的同学下周打算去哪？评论区聊聊。",
        "tags": ["#阿德莱德大学", "#AdelaideUni", "#澳洲留学", "#阿德莱德", "#校园生活", "#留学日常", "#ElderHall"]
      }
    },
    {
      "code": "monash",
      "events": [
        {
          "title": "Pride Night · Doug Ellis 泳池派对",
          "time": "周六 5/4 傍晚（具体时间见 Monash Sport 官网）",
          "location": "Doug Ellis Swimming Pool · Clayton 校区",
          "price": "免费",
          "category": "社交",
          "url": "https://www.monash.edu/sport/events"
        },
        {
          "title": "MSA 免费早餐 · Breakfast Club",
          "time": "周三 5/6 上午 8:30-10:00",
          "location": "学生中心（Campus Centre）· Clayton 校区",
          "price": "免费",
          "category": "免费餐食/社交",
          "url": "https://monashstudentassociation.com.au/services/msa-freebies/breakfast-club/"
        },
        {
          "title": "Mindful May 绘画品饮 · Matheson 图书馆",
          "time": "周四 5/8 白天（时间见活动页）",
          "location": "Matheson 图书馆 · Clayton 校区",
          "price": "免费",
          "category": "艺术/健康",
          "url": "https://www.monash.edu/library/libraries/events-and-exhibitions/mindful-may/events"
        }
      ],
      "xhsDraft": {
        "title": "Monash 下周｜泳池派对+正念月",
        "body": "下周 Monash Clayton 校区有几个活动集中在一起。\n\n周六傍晚，Doug Ellis 游泳馆有 Pride Night 泳池派对，包括 pool games、水上充气设施和 DJ。对外开放，不需要 Monash 学生证。具体开始时间建议去 Monash Sport 官网搜「Pride Night」确认一下。\n\n周三早上 8 点半，MSA 在 Campus Centre 门口做免费早餐，每周三固定有，直接去拿，不需要任何预约或 membership。我刚来 Clayton 第一学期不知道这个，后来才发现是很多人周三出门的起点。\n\n整个五月 Monash 在跑 Mindful May 系列，周四 5/8 在 Matheson 图书馆有一场绘画品饮活动（Paint & Sip），免费参加。Caulfield 校区 5/6 也有一场，两个选一个时间合适的去就行。\n\n有在 Clayton 的同学评论区来聊聊下周的安排？",
        "tags": ["#莫纳什大学", "#Monash", "#澳洲留学", "#墨尔本", "#校园活动", "#正念月", "#留学日常"]
      }
    }
  ]
}
