{
  "schemaVersion": "1.0",
  "date": "2026-04-23",
  "intro": "本周 6 校活动汇总 · 演唱会 + 市集 + 免费小吃 · 大多不用花钱",
  "schools": [
    {
      "code": "umelb",
      "events": [
        {
          "title": "能源未来论坛",
          "time": "周四 4/23 下午 4:30-6:30",
          "location": "Parkville 校区",
          "price": "免费",
          "category": "学术",
          "url": "https://events.unimelb.edu.au"
        },
        {
          "title": "豆腐星期二 · 免费植物午餐",
          "time": "周二 4/28 上午 11:30 - 下午 2:00",
          "location": "Campus Canteen · Parkville / Southbank",
          "price": "免费",
          "category": "社交",
          "url": "https://umsu.unimelb.edu.au/things-to-do/events/"
        },
        {
          "title": "太阳能与能源转型讲座",
          "time": "周三 4/29 下午 2:00-3:00",
          "location": "Parkville 校区",
          "price": "免费",
          "category": "学术",
          "url": "https://events.unimelb.edu.au"
        }
      ],
      "xhsDraft": {
        "title": "UMelb 本周｜免费豆腐餐+能源论坛",
        "body": "在墨大读 Engineering，这周发现两场挺有意思的论坛都免费——周四 Future Energy Forum，下午 4:30 开，进去聊了两小时太阳能和储能，台上有 PhD 生 present，干货比预期多。周三还有 Powering the Future 系列第二讲，专门讲 Solar Power，就在 Parkville，坐进去听一小时比刷纪录片踏实。周二最期待的是 Tofu Tuesdays，Campus Canteen 的免费植物餐，我已经去了四次了，11:30 准时到才能抢好位子，晚了就只能站着。你们 UMelb 的本周还发现什么周中好蹭的吗？",
        "tags": ["#墨尔本大学", "#UMelb", "#澳洲留学", "#墨尔本", "#校园活动", "#留学日常"]
      }
    },
    {
      "code": "unsw",
      "events": [
        {
          "title": "The Beths 乐队巡演",
          "time": "周五 4/24 开场 7:30 pm",
          "location": "UNSW Roundhouse · Kensington",
          "price": "需购票",
          "category": "演唱会",
          "url": "https://premier.ticketek.com.au/shows/show.aspx?sh=BESLWLTH26&v=URH"
        },
        {
          "title": "Baxter Dury · ALLBARONE 巡演",
          "time": "周三 4/29 晚上 7:30",
          "location": "UNSW Roundhouse · Kensington",
          "price": "需购票",
          "category": "演唱会",
          "url": "https://www.songkick.com/concerts/43021650-baxter-dury-at-roundhouse-unsw"
        }
      ],
      "xhsDraft": {
        "title": "UNSW 本周｜Roundhouse 两场",
        "body": "UNSW Roundhouse 这周连续搞事——周五 The Beths 到场，新西兰四件套，新专辑《Straight Line Was A Lie》刚出，这次澳洲巡演是规模最大的一次，Ticketek 还有票但挑座位要快。周三（29 号）Baxter Dury 的 ALLBARONE 巡演压轴进 Roundhouse，风格完全不同，英伦慵懒感，适合喝点酒晃着听。Roundhouse 那个圆形场地共鸣特别好，站哪里声音都包着你。两场都要实体票，记得提前买站票很快就没的。你们有要去看 The Beths 吗？",
        "tags": ["#UNSW", "#新南威尔士大学", "#悉尼", "#澳洲留学", "#演唱会", "#留学日常"]
      }
    },
    {
      "code": "uq",
      "events": [
        {
          "title": "UQU 周三市集",
          "time": "周三 4/29 上午 8:00 - 下午 3:00",
          "location": "Campbell Place · St Lucia 校区",
          "price": "免费入场",
          "category": "市集",
          "url": "https://uqu.com.au/whats-on/"
        }
      ],
      "xhsDraft": {
        "title": "UQ 本周｜St Lucia 周三市集",
        "body": "UQ St Lucia 的周三市集照常开——Campbell Place 从早八点开始，鲜花、植物、手工首饰、小吃摊都有，我每周三会来买一把向日葵，5 刀左右，比超市便宜一半。这周 UQ 公开学生活动比较少，期中备考节奏大家都缩图书馆了。市集当天顺便逛一圈再去学习，Great Court 那边坐坐心情也能好一点。UQ 的同学本周发现什么好蹭的活动吗？评论区告诉我，真的需要一个出门透气的理由 😮‍💨",
        "tags": ["#昆士兰大学", "#UQ", "#布里斯班", "#澳洲留学", "#校园市集", "#留学日常"]
      }
    },
    {
      "code": "usyd",
      "events": [
        {
          "title": "Manning 午间宾果 · 奖金 $100",
          "time": "周四 4/24 中午 12:00-1:00",
          "location": "Manning Bar · Camperdown 校区",
          "price": "免费",
          "category": "社交",
          "url": "https://usu.edu.au/events/campus-sessions-at-manning/"
        },
        {
          "title": "Paddle Battle · 乒乓球比赛",
          "time": "周四 4/24 下午 1:00-3:00",
          "location": "Manning Bar · Camperdown 校区",
          "price": "免费",
          "category": "运动",
          "url": "https://usu.edu.au/events/campus-sessions-at-manning/"
        },
        {
          "title": "Manning 阳台原声现场",
          "time": "周三 4/29 中午 12:00-1:00",
          "location": "Manning Bar 阳台 · Camperdown",
          "price": "免费",
          "category": "现场演出",
          "url": "https://usu.edu.au/events/campus-sessions-at-manning/"
        }
      ],
      "xhsDraft": {
        "title": "USYD 本周｜Manning 三场免费活动",
        "body": "这周 Manning Bar 塞了三件事——周四中午 Lunchtime Bingo，奖品最高 100 澳刀，边吃饭边喊宾果有点荒谬但笑点真的低；同一天下午 1 点 Paddle Battle 乒乓球赛，跨整学期积分记录，赛制比想象认真多了。周三（29 号）Manning 阳台有 Acoustic Unplugged，午饭时间带个三明治在外面坐着听，风从 Camperdown 那边吹来，突然感觉悉尼很好住。Manning Bar 所有活动 18+ 要实体 ID，护照或驾照才认。你们 USYD 还有什么漏网的好活动？",
        "tags": ["#悉尼大学", "#USYD", "#悉尼", "#澳洲留学", "#校园活动", "#留学日常"]
      }
    },
    {
      "code": "adelaide",
      "events": [],
      "xhsDraft": {
        "title": "阿德莱德大学本周｜安静备考周",
        "body": "Adelaide 这周校园公开活动确实少——上周 AUSA 刚在 Morialta 公园带大家徒步，然后就进入了期中备考节奏。North Terrace 的 Hub Central 平时还是有人自发打牌聊天，图书馆外面的草地午休坐着也挺舒服。阿德莱德整个城市节奏本来慢，这种时候反而不焦虑——周围人都不拼命卷，考前一晚能睡着的概率比 Sydney 高多了 😂 你们在 Adelaide 本周有没有发现什么好玩的？留言告诉我 📌",
        "tags": ["#阿德莱德大学", "#Adelaide", "#阿德莱德", "#澳洲留学", "#留学日常", "#校园生活"]
      }
    },
    {
      "code": "monash",
      "events": [
        {
          "title": "MONSU 食物市集",
          "time": "周三 4/29 中午 12:00 - 下午 2:00",
          "location": "The Deck · Caulfield 校区",
          "price": "免费",
          "category": "市集",
          "url": "https://monsu.org/whatson/"
        },
        {
          "title": "MONSU Caulfield 2026 年会",
          "time": "周三 4/29 下午 2:30-3:30",
          "location": "Building K · K101 · Caulfield",
          "price": "免费",
          "category": "社群",
          "url": "https://monsu.org/whatson/"
        },
        {
          "title": "早餐俱乐部",
          "time": "周四 4/30 上午 9:30-11:00",
          "location": "The Deck · Caulfield 校区",
          "price": "免费",
          "category": "社交",
          "url": "https://monsu.org/whatson/"
        }
      ],
      "xhsDraft": {
        "title": "Monash 本周｜Caulfield 三场",
        "body": "Monash Caulfield 这周周三聚了好几件事：中午 MONSU Pantry 市集在 The Deck 开，以前买过芒果冰沙，排十五分钟队值回来的。2:30 同一天有 MONSU Caulfield AGM，进去投票表个态然后能拿到免费 scroll（就是那个卷卷奶油芝士包），吃完再走也行。周四（30 号）还有 Breakfast Club，早上 9:30 在 The Deck，免费的，冬天慢慢来了一杯热的在 Caulfield 吃早饭感觉不错。Clayton 的同学本周活动相对少一些，Caulfield 这周反而热闹。你是哪个 campus 的？",
        "tags": ["#莫纳什大学", "#Monash", "#墨尔本", "#澳洲留学", "#校园活动", "#留学日常"]
      }
    }
  ]
}
